No.     Time           Source                Destination           Protocol Length Info
      1 0.000000000    fe80::fedd:55ff:fe0b:8ed5 ff02::1               ICMPv6   86     Router Advertisement from fc:dd:55:0b:8e:d5
      2 1.938123000    192.168.1.100         192.168.1.1           DNS      76     Standard query 0x6086  A daisy.ubuntu.com
      3 1.938198000    192.168.1.100         192.168.1.1           DNS      76     Standard query 0x3448  AAAA daisy.ubuntu.com
      4 2.023314000    192.168.1.1           192.168.1.100         DNS      314    Standard query response 0x6086  A 91.189.92.57 A 91.189.92.55
      5 2.023425000    192.168.1.1           192.168.1.100         DNS      137    Standard query response 0x3448 
      6 2.938736000    192.168.1.100         192.168.1.1           DNS      76     Standard query 0x322d  A daisy.ubuntu.com
      7 2.938763000    192.168.1.100         192.168.1.1           DNS      76     Standard query 0x34c9  AAAA daisy.ubuntu.com
      8 3.029374000    192.168.1.1           192.168.1.100         DNS      314    Standard query response 0x322d  A 91.189.92.57 A 91.189.92.55
      9 3.029628000    192.168.1.1           192.168.1.100         DNS      137    Standard query response 0x34c9 
     10 3.182973000    68.232.44.121         192.168.1.100         TCP      66     https > 46761 [FIN, ACK] Seq=1 Ack=1 Win=300 Len=0 TSval=277143591 TSecr=14555
     11 3.220524000    192.168.1.100         68.232.44.121         TCP      66     46761 > https [ACK] Seq=1 Ack=2 Win=679 Len=0 TSval=59777 TSecr=277143591
     12 3.344520000    192.168.1.100         216.58.196.110        TCP      66     38777 > http [ACK] Seq=1 Ack=1 Win=262 Len=0 TSval=59808 TSecr=300617425
     13 3.344560000    192.168.1.100         103.18.67.139         TCP      66     47311 > http [ACK] Seq=1 Ack=1 Win=254 Len=0 TSval=59808 TSecr=691632514
     14 3.450761000    103.18.67.139         192.168.1.100         TCP      66     [TCP ACKed unseen segment] http > 47311 [ACK] Seq=1 Ack=2 Win=603 Len=0 TSval=691677576 TSecr=14610
     15 3.450879000    216.58.196.110        192.168.1.100         TCP      66     [TCP ACKed unseen segment] http > 38777 [ACK] Seq=1 Ack=2 Win=385 Len=0 TSval=300662487 TSecr=14624
     16 3.604900000    192.168.1.100         192.168.1.1           DNS      79     Standard query 0x357b  A clients2.google.com
     17 3.605136000    192.168.1.100         192.168.1.1           DNS      76     Standard query 0xc522  A daisy.ubuntu.com
     18 3.605158000    192.168.1.100         192.168.1.1           DNS      76     Standard query 0xa183  AAAA daisy.ubuntu.com
     19 3.675882000    192.168.1.1           192.168.1.100         DNS      255    Standard query response 0x357b  CNAME clients.l.google.com A 216.58.196.110
     20 3.677055000    192.168.1.100         216.58.196.110        TLSv1.2  164    Application Data
     21 3.677131000    192.168.1.100         216.58.196.110        TLSv1.2  112    Application Data
     22 3.677164000    192.168.1.100         216.58.196.110        TLSv1.2  875    Application Data
     23 3.689622000    192.168.1.1           192.168.1.100         DNS      314    Standard query response 0xc522  A 91.189.92.55 A 91.189.92.57
     24 3.689720000    192.168.1.1           192.168.1.100         DNS      137    Standard query response 0xa183 
     25 3.754287000    216.58.196.110        192.168.1.100         TCP      66     https > 46025 [ACK] Seq=1 Ack=99 Win=350 Len=0 TSval=300660812 TSecr=59891
     26 3.754405000    216.58.196.110        192.168.1.100         TCP      66     https > 46025 [ACK] Seq=1 Ack=145 Win=350 Len=0 TSval=300660812 TSecr=59891
     27 3.754573000    216.58.196.110        192.168.1.100         TLSv1.2  112    Application Data
     28 3.792518000    192.168.1.100         216.58.196.110        TCP      66     46025 > https [ACK] Seq=954 Ack=47 Win=381 Len=0 TSval=59920 TSecr=300660814
     29 3.849159000    216.58.196.110        192.168.1.100         TCP      66     https > 46025 [ACK] Seq=47 Ack=954 Win=362 Len=0 TSval=300660906 TSecr=59891
     30 4.009581000    216.58.196.110        192.168.1.100         TLSv1.2  269    Application Data
     31 4.009633000    192.168.1.100         216.58.196.110        TCP      66     46025 > https [ACK] Seq=954 Ack=250 Win=402 Len=0 TSval=59974 TSecr=300661062
     32 4.016089000    216.58.196.110        192.168.1.100         TLSv1.2  820    Application Data
     33 4.016132000    192.168.1.100         216.58.196.110        TCP      66     46025 > https [ACK] Seq=954 Ack=1004 Win=423 Len=0 TSval=59975 TSecr=300661062
     34 4.016153000    216.58.196.110        192.168.1.100         TLSv1.2  112    Application Data
     35 4.016194000    192.168.1.100         216.58.196.110        TCP      66     46025 > https [ACK] Seq=954 Ack=1050 Win=423 Len=0 TSval=59975 TSecr=300661062
     36 4.016811000    192.168.1.100         216.58.196.110        TLSv1.2  112    Application Data
     37 4.018377000    192.168.1.100         192.168.1.1           DNS      75     Standard query 0x560d  A www.gstatic.com
     38 4.117503000    192.168.1.1           192.168.1.100         DNS      250    Standard query response 0x560d  A 74.125.68.120 A 74.125.68.94
     39 4.117827000    216.58.196.110        192.168.1.100         TCP      66     https > 46025 [ACK] Seq=1050 Ack=1000 Win=362 Len=0 TSval=300661152 TSecr=59976
     40 4.117980000    192.168.1.100         74.125.68.120         TCP      74     36376 > http [SYN] Seq=0 Win=29200 Len=0 MSS=1460 SACK_PERM=1 TSval=60001 TSecr=0 WS=128
     41 4.211511000    74.125.68.120         192.168.1.100         TCP      74     http > 36376 [SYN, ACK] Seq=0 Ack=1 Win=42540 Len=0 MSS=1360 SACK_PERM=1 TSval=423547018 TSecr=60001 WS=128
     42 4.211537000    192.168.1.100         74.125.68.120         TCP      66     36376 > http [ACK] Seq=1 Ack=1 Win=29312 Len=0 TSval=60024 TSecr=423547018
     43 4.211654000    192.168.1.100         74.125.68.120         HTTP     348    GET /chrome/crlset/2601/crl-set-delta-2595-13657522432953084478.crx.data HTTP/1.1 
     44 4.324166000    74.125.68.120         192.168.1.100         TCP      66     http > 36376 [ACK] Seq=1 Ack=283 Win=43648 Len=0 TSval=423547126 TSecr=60024
     45 4.346530000    74.125.68.120         192.168.1.100         TCP      1414   [TCP segment of a reassembled PDU]
     46 4.346573000    192.168.1.100         74.125.68.120         TCP      66     36376 > http [ACK] Seq=283 Ack=1349 Win=32128 Len=0 TSval=60058 TSecr=423547127
     47 4.359358000    74.125.68.120         192.168.1.100         TCP      1414   [TCP segment of a reassembled PDU]
     48 4.359392000    192.168.1.100         74.125.68.120         TCP      66     36376 > http [ACK] Seq=283 Ack=2697 Win=35072 Len=0 TSval=60061 TSecr=423547127
     49 4.377535000    74.125.68.120         192.168.1.100         HTTP     933    HTTP/1.1 200 OK  (text/html)
     50 4.377577000    192.168.1.100         74.125.68.120         TCP      66     36376 > http [ACK] Seq=283 Ack=3564 Win=37760 Len=0 TSval=60066 TSecr=423547127
     51 4.387880000    192.168.1.100         216.58.196.110        UDP      1392   Source port: 46358  Destination port: https
     52 4.388226000    192.168.1.100         216.58.196.110        TLSv1.2  138    Application Data
     53 4.388305000    192.168.1.100         216.58.196.110        TLSv1.2  811    Application Data
     54 4.527559000    216.58.196.110        192.168.1.100         TCP      66     https > 46025 [ACK] Seq=1050 Ack=1072 Win=362 Len=0 TSval=300661569 TSecr=60068
     55 4.538890000    192.168.1.100         216.58.196.110        UDP      1392   Source port: 46358  Destination port: https
     56 4.541161000    216.58.196.110        192.168.1.100         TCP      66     https > 46025 [ACK] Seq=1050 Ack=1817 Win=375 Len=0 TSval=300661578 TSecr=60068
     57 4.548027000    216.58.196.110        192.168.1.100         UDP      1392   Source port: https  Destination port: 46358
     58 4.564205000    216.58.196.110        192.168.1.100         UDP      1392   Source port: https  Destination port: 46358
     59 4.564302000    216.58.196.110        192.168.1.100         UDP      79     Source port: https  Destination port: 46358
     60 4.567692000    192.168.1.100         216.58.196.110        UDP      1392   Source port: 46358  Destination port: https
     61 4.593643000    192.168.1.100         216.58.196.110        UDP      82     Source port: 46358  Destination port: https
     62 4.608399000    192.168.1.100         192.168.1.1           DNS      76     Standard query 0xa8fb  A daisy.ubuntu.com
     63 4.608512000    192.168.1.100         192.168.1.1           DNS      76     Standard query 0x5279  AAAA daisy.ubuntu.com
     64 4.683073000    216.58.196.110        192.168.1.100         UDP      1392   Source port: https  Destination port: 46358
     65 4.695765000    216.58.196.110        192.168.1.100         UDP      1392   Source port: https  Destination port: 46358
     66 4.695851000    192.168.1.100         216.58.196.110        UDP      82     Source port: 46358  Destination port: https
     67 4.709155000    192.168.1.1           192.168.1.100         DNS      314    Standard query response 0xa8fb  A 91.189.92.55 A 91.189.92.57
     68 4.715778000    192.168.1.1           192.168.1.100         DNS      137    Standard query response 0x5279 
     69 4.729865000    216.58.196.110        192.168.1.100         UDP      1392   Source port: https  Destination port: 46358
     70 4.729899000    216.58.196.110        192.168.1.100         TLSv1.2  152    Application Data
     71 4.731360000    192.168.1.100         216.58.196.110        UDP      79     Source port: 46358  Destination port: https
     72 4.768514000    192.168.1.100         216.58.196.110        TCP      66     46025 > https [ACK] Seq=1817 Ack=1136 Win=423 Len=0 TSval=60164 TSecr=300661784
     73 4.788473000    192.168.1.100         198.252.206.25        TCP      66     38025 > https [ACK] Seq=1 Ack=1 Win=245 Len=0 TSval=60169 TSecr=2397011889
     74 4.919197000    216.58.196.110        192.168.1.100         TLSv1.2  415    Application Data
     75 4.919243000    192.168.1.100         216.58.196.110        TCP      66     46025 > https [ACK] Seq=1817 Ack=1485 Win=444 Len=0 TSval=60201 TSecr=300661785
     76 4.919605000    216.58.196.110        192.168.1.100         TLSv1.2  112    Application Data
     77 4.919661000    192.168.1.100         216.58.196.110        TCP      66     46025 > https [ACK] Seq=1817 Ack=1531 Win=444 Len=0 TSval=60201 TSecr=300661786
     78 4.919758000    216.58.196.110        192.168.1.100         UDP      74     Source port: https  Destination port: 46358
     79 4.919953000    192.168.1.100         216.58.196.110        TLSv1.2  112    Application Data
     80 5.001165000    fe80::fedd:55ff:fe0b:8ed5 ff02::1               ICMPv6   86     Router Advertisement from fc:dd:55:0b:8e:d5
     81 5.024067000    216.58.196.110        192.168.1.100         TCP      66     https > 46025 [ACK] Seq=1531 Ack=1863 Win=375 Len=0 TSval=300662076 TSecr=60201
     82 5.070732000    198.252.206.25        192.168.1.100         TCP      66     [TCP ACKed unseen segment] https > 38025 [ACK] Seq=1 Ack=2 Win=33 Len=0 TSval=2397057151 TSecr=14854
     83 7.116465000    192.168.1.100         216.58.196.98         TCP      66     40322 > https [ACK] Seq=1 Ack=1 Win=339 Len=0 TSval=60751 TSecr=300619183
     84 7.202790000    216.58.196.98         192.168.1.100         TCP      66     [TCP ACKed unseen segment] https > 40322 [ACK] Seq=1 Ack=2 Win=358 Len=0 TSval=300664249 TSecr=26925
     85 7.596511000    192.168.1.100         216.58.196.104        TCP      66     54093 > https [ACK] Seq=1 Ack=1 Win=360 Len=0 TSval=60871 TSecr=300619657
     86 7.680934000    216.58.196.104        192.168.1.100         TCP      66     [TCP ACKed unseen segment] https > 54093 [ACK] Seq=1 Ack=2 Win=366 Len=0 TSval=300664729 TSecr=27020
     87 7.732429000    192.168.1.100         216.58.196.97         TCP      66     51580 > https [ACK] Seq=1 Ack=1 Win=316 Len=0 TSval=60905 TSecr=300616332
     88 7.736456000    192.168.1.100         216.58.196.97         TCP      66     51579 > https [ACK] Seq=1 Ack=1 Win=316 Len=0 TSval=60906 TSecr=300620406
     89 7.807588000    216.58.196.97         192.168.1.100         TCP      66     [TCP ACKed unseen segment] https > 51580 [ACK] Seq=1 Ack=2 Win=350 Len=0 TSval=300661418 TSecr=27102
     90 7.807768000    216.58.196.97         192.168.1.100         TCP      66     [TCP ACKed unseen segment] https > 51579 [ACK] Seq=1 Ack=2 Win=350 Len=0 TSval=300665492 TSecr=27112
     91 9.592496000    192.168.1.100         87.230.101.26         TCP      66     44017 > https [ACK] Seq=1 Ack=1 Win=245 Len=0 TSval=61370 TSecr=2354549969
     92 9.692491000    192.168.1.100         87.230.101.26         TCP      66     44018 > https [ACK] Seq=1 Ack=1 Win=402 Len=0 TSval=61395 TSecr=2354550031
     93 9.797278000    87.230.101.26         192.168.1.100         TCP      54     https > 44017 [RST] Seq=1 Win=0 Len=0
     94 10.002497000   fe80::fedd:55ff:fe0b:8ed5 ff02::1               ICMPv6   86     Router Advertisement from fc:dd:55:0b:8e:d5
     95 10.082756000   87.230.101.26         192.168.1.100         TCP      54     https > 44018 [RST] Seq=1 Win=0 Len=0
     96 10.256510000   192.168.1.100         216.58.220.46         TCP      66     37390 > https [ACK] Seq=1 Ack=1 Win=3118 Len=0 TSval=61536 TSecr=296613392
     97 10.336711000   216.58.220.46         192.168.1.100         TCP      66     [TCP ACKed unseen segment] https > 37390 [ACK] Seq=1 Ack=2 Win=366 Len=0 TSval=296658512 TSecr=5073
     98 13.312515000   192.168.1.100         87.230.101.26         TCP      66     44019 > https [ACK] Seq=1 Ack=1 Win=229 Len=0 TSval=62300 TSecr=2354550934
     99 13.539384000   87.230.101.26         192.168.1.100         TCP      66     [TCP ACKed unseen segment] https > 44019 [ACK] Seq=1 Ack=2 Win=227 Len=0 TSval=2354562237 TSecr=39743
    100 15.003644000   fe80::fedd:55ff:fe0b:8ed5 ff02::1               ICMPv6   86     Router Advertisement from fc:dd:55:0b:8e:d5
    101 18.576479000   192.168.1.100         74.125.68.91          TCP      66     59513 > https [ACK] Seq=1 Ack=1 Win=809 Len=0 TSval=63616 TSecr=412557153
    102 18.671252000   74.125.68.91          192.168.1.100         TCP      66     [TCP ACKed unseen segment] https > 59513 [ACK] Seq=1 Ack=2 Win=911 Len=0 TSval=412602279 TSecr=7122
    103 18.832501000   192.168.1.100         216.58.196.110        TCP      66     45965 > https [ACK] Seq=1 Ack=1 Win=533 Len=0 TSval=63680 TSecr=300626502
    104 18.898009000   216.58.196.110        192.168.1.100         TCP      66     [TCP ACKed unseen segment] https > 45965 [ACK] Seq=1 Ack=2 Win=480 Len=0 TSval=300671663 TSecr=29830
    105 20.005254000   fe80::fedd:55ff:fe0b:8ed5 ff02::1               ICMPv6   86     Router Advertisement from fc:dd:55:0b:8e:d5
    106 23.672518000   192.168.1.100         69.164.220.180        TCP      66     35568 > https [ACK] Seq=1 Ack=1 Win=229 Len=0 TSval=64890 TSecr=370451907
    107 23.730232000   216.58.220.46         192.168.1.100         TLSv1.2  129    [TCP ACKed unseen segment] Application Data
    108 23.730309000   216.58.220.46         192.168.1.100         TCP      66     [TCP ACKed unseen segment] https > 37390 [FIN, ACK] Seq=64 Ack=2 Win=366 Len=0 TSval=296671901 TSecr=5073
    109 23.730608000   192.168.1.100         216.58.220.46         TCP      66     [TCP Previous segment not captured] 37390 > https [FIN, ACK] Seq=2 Ack=65 Win=3118 Len=0 TSval=64904 TSecr=296671901
    110 23.828715000   216.58.220.46         192.168.1.100         TCP      66     [TCP ACKed unseen segment] https > 37390 [ACK] Seq=65 Ack=3 Win=366 Len=0 TSval=296671993 TSecr=64904
    111 24.011606000   69.164.220.180        192.168.1.100         TCP      54     https > 35568 [RST] Seq=1 Win=0 Len=0
    112 25.006381000   fe80::fedd:55ff:fe0b:8ed5 ff02::1               ICMPv6   86     Router Advertisement from fc:dd:55:0b:8e:d5
    113 26.920483000   192.168.1.100         216.58.196.99         TCP      66     60219 > https [ACK] Seq=1 Ack=1 Win=239 Len=0 TSval=65702 TSecr=300641714
    114 27.024613000   216.58.196.99         192.168.1.100         TCP      66     [TCP ACKed unseen segment] https > 60219 [ACK] Seq=1 Ack=2 Win=350 Len=0 TSval=300686936 TSecr=9217
    115 30.007480000   fe80::fedd:55ff:fe0b:8ed5 ff02::1               ICMPv6   86     Router Advertisement from fc:dd:55:0b:8e:d5
    116 30.872467000   192.168.1.100         198.252.206.25        TCP      66     38000 > https [ACK] Seq=1 Ack=1 Win=337 Len=0 TSval=66690 TSecr=2397037971
    117 31.146921000   198.252.206.25        192.168.1.100         TCP      66     [TCP ACKed unseen segment] https > 38000 [ACK] Seq=1 Ack=2 Win=35 Len=0 TSval=2397083232 TSecr=10099
    118 32.584428000   74.125.68.91          192.168.1.100         TLSv1.2  129    [TCP ACKed unseen segment] Application Data
    119 32.584781000   192.168.1.100         74.125.68.91          TCP      66     [TCP Previous segment not captured] 59513 > https [FIN, ACK] Seq=2 Ack=64 Win=809 Len=0 TSval=67118 TSecr=412616200
    120 32.590931000   74.125.68.91          192.168.1.100         TCP      66     [TCP ACKed unseen segment] https > 59513 [FIN, ACK] Seq=64 Ack=2 Win=911 Len=0 TSval=412616200 TSecr=7122
    121 32.590982000   192.168.1.100         74.125.68.91          TCP      66     59513 > https [ACK] Seq=3 Ack=65 Win=809 Len=0 TSval=67119 TSecr=412616200
    122 32.680942000   74.125.68.91          192.168.1.100         TCP      66     https > 59513 [ACK] Seq=65 Ack=3 Win=911 Len=0 TSval=412616292 TSecr=67118
    123 33.112516000   192.168.1.100         74.125.68.188         TCP      66     39816 > hpvroom [ACK] Seq=1 Ack=1 Win=260 Len=0 TSval=67250 TSecr=426334794
    124 33.232014000   74.125.68.188         192.168.1.100         TCP      66     [TCP ACKed unseen segment] hpvroom > 39816 [ACK] Seq=1 Ack=2 Win=358 Len=0 TSval=426379907 TSecr=4294955361
    125 35.008615000   fe80::fedd:55ff:fe0b:8ed5 ff02::1               ICMPv6   86     Router Advertisement from fc:dd:55:0b:8e:d5
    126 36.752518000   192.168.1.100         74.125.68.95          TCP      66     56655 > https [ACK] Seq=1 Ack=1 Win=857 Len=0 TSval=68160 TSecr=858206131
    127 36.860820000   74.125.68.95          192.168.1.100         TCP      66     [TCP ACKed unseen segment] https > 56655 [ACK] Seq=1 Ack=2 Win=358 Len=0 TSval=858251285 TSecr=11742
    128 40.009697000   fe80::fedd:55ff:fe0b:8ed5 ff02::1               ICMPv6   86     Router Advertisement from fc:dd:55:0b:8e:d5
    129 40.570264000   216.58.196.99         192.168.1.100         TLSv1.2  129    [TCP ACKed unseen segment] Application Data
    130 40.570313000   192.168.1.100         216.58.196.99         TCP      66     [TCP Previous segment not captured] 60219 > https [ACK] Seq=2 Ack=64 Win=239 Len=0 TSval=69114 TSecr=300700499
    131 40.570622000   192.168.1.100         216.58.196.99         TCP      66     60219 > https [FIN, ACK] Seq=2 Ack=64 Win=239 Len=0 TSval=69114 TSecr=300700499
    132 40.572237000   216.58.196.99         192.168.1.100         TCP      66     [TCP ACKed unseen segment] https > 60219 [FIN, ACK] Seq=64 Ack=2 Win=350 Len=0 TSval=300700499 TSecr=9217
    133 40.572283000   192.168.1.100         216.58.196.99         TCP      66     60219 > https [ACK] Seq=3 Ack=65 Win=239 Len=0 TSval=69114 TSecr=300700499
    134 40.663866000   216.58.196.99         192.168.1.100         TCP      66     https > 60219 [ACK] Seq=65 Ack=3 Win=350 Len=0 TSval=300700588 TSecr=69114
    135 45.011227000   fe80::fedd:55ff:fe0b:8ed5 ff02::1               ICMPv6   86     Router Advertisement from fc:dd:55:0b:8e:d5
    136 48.272514000   192.168.1.100         68.232.44.121         TCP      66     [TCP Keep-Alive] 46761 > https [ACK] Seq=0 Ack=2 Win=679 Len=0 TSval=71040 TSecr=277143591
    137 48.396690000   68.232.44.121         192.168.1.100         TCP      54     https > 46761 [RST] Seq=2 Win=0 Len=0
    138 48.448517000   192.168.1.100         216.58.196.110        TCP      66     [TCP Dup ACK 12#1] 38777 > http [ACK] Seq=1 Ack=1 Win=262 Len=0 TSval=71084 TSecr=300662487
    139 48.448548000   192.168.1.100         103.18.67.139         TCP      66     [TCP Dup ACK 13#1] 47311 > http [ACK] Seq=1 Ack=1 Win=254 Len=0 TSval=71084 TSecr=691677576
    140 48.494186000   103.18.67.139         192.168.1.100         TCP      66     [TCP Dup ACK 14#1] [TCP ACKed unseen segment] http > 47311 [ACK] Seq=1 Ack=2 Win=603 Len=0 TSval=691722683 TSecr=14610
    141 48.508243000   216.58.196.110        192.168.1.100         TCP      66     [TCP Dup ACK 15#1] [TCP ACKed unseen segment] http > 38777 [ACK] Seq=1 Ack=2 Win=385 Len=0 TSval=300707593 TSecr=14624
    142 49.376491000   192.168.1.100         74.125.68.120         TCP      66     [TCP Keep-Alive] 36376 > http [ACK] Seq=282 Ack=3564 Win=37760 Len=0 TSval=71316 TSecr=423547127
    143 49.481475000   74.125.68.120         192.168.1.100         TCP      66     [TCP Keep-Alive ACK] http > 36376 [ACK] Seq=3564 Ack=283 Win=43648 Len=0 TSval=423592277 TSecr=60066
    144 50.012263000   fe80::fedd:55ff:fe0b:8ed5 ff02::1               ICMPv6   86     Router Advertisement from fc:dd:55:0b:8e:d5
    145 50.064492000   192.168.1.100         216.58.196.110        TCP      66     [TCP Keep-Alive] 46025 > https [ACK] Seq=1862 Ack=1531 Win=444 Len=0 TSval=71488 TSecr=300662076
    146 50.068515000   192.168.1.100         198.252.206.25        TCP      66     [TCP Dup ACK 73#1] 38025 > https [ACK] Seq=1 Ack=1 Win=245 Len=0 TSval=71489 TSecr=2397057151
    147 50.125623000   216.58.196.110        192.168.1.100         TCP      66     [TCP Keep-Alive ACK] https > 46025 [ACK] Seq=1531 Ack=1863 Win=375 Len=0 TSval=300707184 TSecr=60201
    148 50.324297000   198.252.206.25        192.168.1.100         TCP      66     [TCP Dup ACK 82#1] [TCP ACKed unseen segment] https > 38025 [ACK] Seq=1 Ack=2 Win=33 Len=0 TSval=2397102430 TSecr=14854
    149 50.979474000   74.125.68.95          192.168.1.100         TLSv1.2  129    [TCP ACKed unseen segment] Application Data
    150 50.979594000   74.125.68.95          192.168.1.100         TCP      66     [TCP ACKed unseen segment] https > 56655 [FIN, ACK] Seq=64 Ack=2 Win=358 Len=0 TSval=858265403 TSecr=11742
    151 50.979837000   192.168.1.100         74.125.68.95          TCP      66     [TCP Previous segment not captured] 56655 > https [FIN, ACK] Seq=2 Ack=65 Win=857 Len=0 TSval=71716 TSecr=858265403
    152 51.092709000   74.125.68.95          192.168.1.100         TCP      66     [TCP ACKed unseen segment] https > 56655 [ACK] Seq=65 Ack=3 Win=358 Len=0 TSval=858265512 TSecr=71716
    153 52.240513000   192.168.1.100         216.58.196.98         TCP      66     [TCP Dup ACK 83#1] 40322 > https [ACK] Seq=1 Ack=1 Win=339 Len=0 TSval=72032 TSecr=300664249
    154 52.321802000   216.58.196.98         192.168.1.100         TCP      66     [TCP Dup ACK 84#1] [TCP ACKed unseen segment] https > 40322 [ACK] Seq=1 Ack=2 Win=358 Len=0 TSval=300709370 TSecr=26925
    155 52.680434000   192.168.1.100         216.58.196.104        TCP      66     [TCP Dup ACK 85#1] 54093 > https [ACK] Seq=1 Ack=1 Win=360 Len=0 TSval=72142 TSecr=300664729
    156 52.779044000   216.58.196.104        192.168.1.100         TCP      66     [TCP Dup ACK 86#1] [TCP ACKed unseen segment] https > 54093 [ACK] Seq=1 Ack=2 Win=366 Len=0 TSval=300709795 TSecr=27020
    157 52.880442000   192.168.1.100         216.58.196.97         TCP      66     [TCP Dup ACK 87#1] 51580 > https [ACK] Seq=1 Ack=1 Win=316 Len=0 TSval=72192 TSecr=300661418
    158 52.880471000   192.168.1.100         216.58.196.97         TCP      66     [TCP Dup ACK 88#1] 51579 > https [ACK] Seq=1 Ack=1 Win=316 Len=0 TSval=72192 TSecr=300665492
    159 52.966085000   216.58.196.97         192.168.1.100         TCP      66     [TCP Dup ACK 89#1] [TCP ACKed unseen segment] https > 51580 [ACK] Seq=1 Ack=2 Win=350 Len=0 TSval=300706561 TSecr=27102
    160 52.966283000   216.58.196.97         192.168.1.100         TCP      66     [TCP Dup ACK 90#1] [TCP ACKed unseen segment] https > 51579 [ACK] Seq=1 Ack=2 Win=350 Len=0 TSval=300710635 TSecr=27112
    161 55.013331000   fe80::fedd:55ff:fe0b:8ed5 ff02::1               ICMPv6   86     Router Advertisement from fc:dd:55:0b:8e:d5
    162 58.536512000   192.168.1.100         87.230.101.26         TCP      66     [TCP Dup ACK 98#1] 44019 > https [ACK] Seq=1 Ack=1 Win=229 Len=0 TSval=73606 TSecr=2354562237
    163 58.749146000   87.230.101.26         192.168.1.100         TCP      66     [TCP Dup ACK 99#1] [TCP ACKed unseen segment] https > 44019 [ACK] Seq=1 Ack=2 Win=227 Len=0 TSval=2354573541 TSecr=39743
    164 60.014483000   fe80::fedd:55ff:fe0b:8ed5 ff02::1               ICMPv6   86     Router Advertisement from fc:dd:55:0b:8e:d5
    165 61.970171000   192.168.1.100         192.168.1.1           DNS      76     Standard query 0x37de  A daisy.ubuntu.com
    166 61.970247000   192.168.1.100         192.168.1.1           DNS      76     Standard query 0x0993  AAAA daisy.ubuntu.com
    167 62.063930000   192.168.1.1           192.168.1.100         DNS      314    Standard query response 0x37de  A 91.189.92.55 A 91.189.92.57
    168 62.069572000   192.168.1.1           192.168.1.100         DNS      137    Standard query response 0x0993 
    169 62.583904000   216.58.196.110        192.168.1.100         TCP      66     [TCP ACKed unseen segment] http > 38777 [FIN, ACK] Seq=1 Ack=2 Win=385 Len=0 TSval=300721667 TSecr=14624
    170 62.620516000   192.168.1.100         216.58.196.110        TCP      66     [TCP Previous segment not captured] 38777 > http [ACK] Seq=2 Ack=2 Win=262 Len=0 TSval=74627 TSecr=300721667
    171 62.970935000   192.168.1.100         192.168.1.1           DNS      76     Standard query 0x44ae  A daisy.ubuntu.com
    172 62.970963000   192.168.1.100         192.168.1.1           DNS      76     Standard query 0xebf5  AAAA daisy.ubuntu.com
    173 63.063465000   192.168.1.1           192.168.1.100         DNS      314    Standard query response 0x44ae  A 91.189.92.55 A 91.189.92.57
    174 63.063598000   192.168.1.1           192.168.1.100         DNS      137    Standard query response 0xebf5 
    175 63.896512000   192.168.1.100         216.58.196.110        TCP      66     [TCP Dup ACK 103#1] 45965 > https [ACK] Seq=1 Ack=1 Win=533 Len=0 TSval=74946 TSecr=300671663
    176 63.989965000   216.58.196.110        192.168.1.100         TCP      66     [TCP Dup ACK 104#1] [TCP ACKed unseen segment] https > 45965 [ACK] Seq=1 Ack=2 Win=480 Len=0 TSval=300716750 TSecr=29830
    177 65.015591000   fe80::fedd:55ff:fe0b:8ed5 ff02::1               ICMPv6   86     Router Advertisement from fc:dd:55:0b:8e:d5
    178 70.016760000   fe80::fedd:55ff:fe0b:8ed5 ff02::1               ICMPv6   86     Router Advertisement from fc:dd:55:0b:8e:d5
    179 75.027944000   fe80::fedd:55ff:fe0b:8ed5 ff02::1               ICMPv6   86     Router Advertisement from fc:dd:55:0b:8e:d5
    180 76.144521000   192.168.1.100         198.252.206.25        TCP      66     [TCP Dup ACK 116#1] 38000 > https [ACK] Seq=1 Ack=1 Win=337 Len=0 TSval=78008 TSecr=2397083232
    181 76.955697000   198.252.206.25        192.168.1.100         TCP      66     [TCP Dup ACK 117#1] [TCP ACKed unseen segment] https > 38000 [ACK] Seq=1 Ack=2 Win=35 Len=0 TSval=2397129061 TSecr=10099
    182 78.228502000   192.168.1.100         74.125.68.188         TCP      66     [TCP Dup ACK 123#1] 39816 > hpvroom [ACK] Seq=1 Ack=1 Win=260 Len=0 TSval=78529 TSecr=426379907
    183 78.349007000   74.125.68.188         192.168.1.100         TCP      66     [TCP Dup ACK 124#1] [TCP ACKed unseen segment] hpvroom > 39816 [ACK] Seq=1 Ack=2 Win=358 Len=0 TSval=426425022 TSecr=4294955361
    184 80.030786000   fe80::fedd:55ff:fe0b:8ed5 ff02::1               ICMPv6   86     Router Advertisement from fc:dd:55:0b:8e:d5
    185 85.033014000   fe80::fedd:55ff:fe0b:8ed5 ff02::1               ICMPv6   86     Router Advertisement from fc:dd:55:0b:8e:d5
    186 90.037568000   fe80::fedd:55ff:fe0b:8ed5 ff02::1               ICMPv6   86     Router Advertisement from fc:dd:55:0b:8e:d5
    187 93.584489000   192.168.1.100         103.18.67.139         TCP      66     [TCP Dup ACK 13#2] 47311 > http [ACK] Seq=1 Ack=1 Win=254 Len=0 TSval=82368 TSecr=691722683
    188 94.195353000   103.18.67.139         192.168.1.100         TCP      66     [TCP Dup ACK 14#2] [TCP ACKed unseen segment] http > 47311 [ACK] Seq=1 Ack=2 Win=603 Len=0 TSval=691768361 TSecr=14610
    189 94.480513000   192.168.1.100         74.125.68.120         TCP      66     [TCP Keep-Alive] 36376 > http [ACK] Seq=282 Ack=3564 Win=37760 Len=0 TSval=82592 TSecr=423592277
    190 94.591348000   74.125.68.120         192.168.1.100         TCP      66     [TCP Keep-Alive ACK] http > 36376 [ACK] Seq=3564 Ack=283 Win=43648 Len=0 TSval=423637398 TSecr=60066
    191 95.041058000   fe80::fedd:55ff:fe0b:8ed5 ff02::1               ICMPv6   86     Router Advertisement from fc:dd:55:0b:8e:d5
    192 95.124501000   192.168.1.100         216.58.196.110        TCP      66     [TCP Keep-Alive] 46025 > https [ACK] Seq=1862 Ack=1531 Win=444 Len=0 TSval=82753 TSecr=300707184
    193 95.202026000   216.58.196.110        192.168.1.100         TCP      66     [TCP Keep-Alive ACK] https > 46025 [ACK] Seq=1531 Ack=1863 Win=375 Len=0 TSval=300752244 TSecr=60201
    194 95.320521000   192.168.1.100         198.252.206.25        TCP      66     [TCP Dup ACK 73#2] 38025 > https [ACK] Seq=1 Ack=1 Win=245 Len=0 TSval=82802 TSecr=2397102430
    195 95.601413000   198.252.206.25        192.168.1.100         TCP      66     [TCP Dup ACK 82#2] [TCP ACKed unseen segment] https > 38025 [ACK] Seq=1 Ack=2 Win=33 Len=0 TSval=2397147671 TSecr=14854
    196 97.320477000   192.168.1.100         216.58.196.98         TCP      66     [TCP Dup ACK 83#2] 40322 > https [ACK] Seq=1 Ack=1 Win=339 Len=0 TSval=83302 TSecr=300709370
    197 97.392913000   216.58.196.98         192.168.1.100         TCP      66     [TCP Dup ACK 84#2] [TCP ACKed unseen segment] https > 40322 [ACK] Seq=1 Ack=2 Win=358 Len=0 TSval=300754453 TSecr=26925
    198 97.808457000   192.168.1.100         216.58.196.104        TCP      66     [TCP Dup ACK 85#2] 54093 > https [ACK] Seq=1 Ack=1 Win=360 Len=0 TSval=83424 TSecr=300709795
    199 97.866105000   216.58.196.104        192.168.1.100         TCP      66     [TCP Dup ACK 86#2] [TCP ACKed unseen segment] https > 54093 [ACK] Seq=1 Ack=2 Win=366 Len=0 TSval=300754927 TSecr=27020
    200 97.964512000   192.168.1.100         216.58.196.97         TCP      66     [TCP Dup ACK 87#2] 51580 > https [ACK] Seq=1 Ack=1 Win=316 Len=0 TSval=83463 TSecr=300706561
    201 97.964553000   192.168.1.100         216.58.196.97         TCP      66     [TCP Dup ACK 88#2] 51579 > https [ACK] Seq=1 Ack=1 Win=316 Len=0 TSval=83463 TSecr=300710635
    202 98.021947000   216.58.196.97         192.168.1.100         TCP      66     [TCP Dup ACK 89#2] [TCP ACKed unseen segment] https > 51580 [ACK] Seq=1 Ack=2 Win=350 Len=0 TSval=300751621 TSecr=27102
    203 98.028440000   216.58.196.97         192.168.1.100         TCP      66     [TCP Dup ACK 90#2] [TCP ACKed unseen segment] https > 51579 [ACK] Seq=1 Ack=2 Win=350 Len=0 TSval=300755701 TSecr=27112
    204 100.042477000  fe80::fedd:55ff:fe0b:8ed5 ff02::1               ICMPv6   86     Router Advertisement from fc:dd:55:0b:8e:d5
    205 103.748516000  192.168.1.100         87.230.101.26         TCP      66     [TCP Dup ACK 98#2] 44019 > https [ACK] Seq=1 Ack=1 Win=229 Len=0 TSval=84909 TSecr=2354573541
    206 103.983611000  87.230.101.26         192.168.1.100         TCP      66     [TCP Dup ACK 99#2] [TCP ACKed unseen segment] https > 44019 [ACK] Seq=1 Ack=2 Win=227 Len=0 TSval=2354584846 TSecr=39743
    207 105.044336000  fe80::fedd:55ff:fe0b:8ed5 ff02::1               ICMPv6   86     Router Advertisement from fc:dd:55:0b:8e:d5
    208 105.251650000  198.252.206.25        192.168.1.100         TLSv1.2  124    [TCP ACKed unseen segment] Application Data
    209 105.252490000  192.168.1.100         198.252.206.25        TLSv1.2  103    [TCP Previous segment not captured] Application Data
    210 105.570048000  198.252.206.25        192.168.1.100         TCP      66     [TCP ACKed unseen segment] https > 38000 [ACK] Seq=59 Ack=39 Win=35 Len=0 TSval=2397157662 TSecr=85285
    211 107.600499000  192.168.1.100         216.58.196.110        TCP      66     [TCP Keep-Alive] 38777 > http [ACK] Seq=1 Ack=2 Win=262 Len=0 TSval=85872 TSecr=300721667
    212 107.690069000  216.58.196.110        192.168.1.100         TCP      54     http > 38777 [RST] Seq=2 Win=0 Len=0
    213 108.752440000  Shenzhen_ff:ff:ff     Shenzhen_0b:8e:d5     ARP      42     Who has 192.168.1.1?  Tell 192.168.1.100
    214 108.760606000  Shenzhen_0b:8e:d5     Shenzhen_ff:ff:ff     ARP      42     192.168.1.1 is at fc:dd:55:0b:8e:d5
    215 108.988466000  192.168.1.100         216.58.196.110        TCP      66     [TCP Dup ACK 103#2] 45965 > https [ACK] Seq=1 Ack=1 Win=533 Len=0 TSval=86219 TSecr=300716750
    216 109.119155000  216.58.196.110        192.168.1.100         TCP      66     [TCP Dup ACK 104#2] [TCP ACKed unseen segment] https > 45965 [ACK] Seq=1 Ack=2 Win=480 Len=0 TSval=300761826 TSecr=29830
    217 110.045377000  fe80::fedd:55ff:fe0b:8ed5 ff02::1               ICMPv6   86     Router Advertisement from fc:dd:55:0b:8e:d5
    218 111.786488000  216.58.196.98         192.168.1.100         TLSv1.2  129    [TCP ACKed unseen segment] Application Data
    219 111.786581000  216.58.196.98         192.168.1.100         TCP      66     [TCP ACKed unseen segment] https > 40322 [FIN, ACK] Seq=64 Ack=2 Win=358 Len=0 TSval=300768834 TSecr=26925
    220 111.786942000  192.168.1.100         216.58.196.98         TCP      66     [TCP Previous segment not captured] 40322 > https [FIN, ACK] Seq=2 Ack=65 Win=339 Len=0 TSval=86918 TSecr=300768834
    221 112.015441000  216.58.196.98         192.168.1.100         TCP      66     [TCP ACKed unseen segment] https > 40322 [ACK] Seq=65 Ack=3 Win=358 Len=0 TSval=300768924 TSecr=86918
    222 112.195460000  216.58.196.104        192.168.1.100         TLSv1.2  129    [TCP ACKed unseen segment] Application Data
    223 112.195563000  216.58.196.104        192.168.1.100         TCP      66     [TCP ACKed unseen segment] https > 54093 [FIN, ACK] Seq=64 Ack=2 Win=366 Len=0 TSval=300769248 TSecr=27020
    224 112.195805000  192.168.1.100         216.58.196.104        TCP      66     [TCP Previous segment not captured] 54093 > https [FIN, ACK] Seq=2 Ack=65 Win=360 Len=0 TSval=87020 TSecr=300769248
    225 112.256109000  216.58.196.104        192.168.1.100         TCP      66     [TCP ACKed unseen segment] https > 54093 [ACK] Seq=65 Ack=3 Win=366 Len=0 TSval=300769312 TSecr=87020
    226 112.490510000  216.58.196.97         192.168.1.100         TLSv1.2  129    [TCP ACKed unseen segment] Application Data
    227 112.490531000  192.168.1.100         216.58.196.97         TCP      66     [TCP Previous segment not captured] 51579 > https [ACK] Seq=2 Ack=64 Win=316 Len=0 TSval=87094 TSecr=300770164
    228 112.490644000  216.58.196.97         192.168.1.100         TCP      66     [TCP ACKed unseen segment] https > 51579 [FIN, ACK] Seq=64 Ack=2 Win=350 Len=0 TSval=300770164 TSecr=27112
    229 112.497069000  216.58.196.97         192.168.1.100         TLSv1.2  129    [TCP ACKed unseen segment] Application Data
    230 112.497090000  192.168.1.100         216.58.196.97         TCP      66     [TCP Previous segment not captured] 51580 > https [ACK] Seq=2 Ack=64 Win=316 Len=0 TSval=87096 TSecr=300766102
    231 112.497158000  216.58.196.97         192.168.1.100         TCP      66     [TCP ACKed unseen segment] https > 51580 [FIN, ACK] Seq=64 Ack=2 Win=350 Len=0 TSval=300766102 TSecr=27102
    232 112.528454000  192.168.1.100         216.58.196.97         TCP      66     51579 > https [ACK] Seq=2 Ack=65 Win=316 Len=0 TSval=87104 TSecr=300770164
    233 112.536453000  192.168.1.100         216.58.196.97         TCP      66     51580 > https [ACK] Seq=2 Ack=65 Win=316 Len=0 TSval=87106 TSecr=300766102
    234 115.046550000  fe80::fedd:55ff:fe0b:8ed5 ff02::1               ICMPv6   86     Router Advertisement from fc:dd:55:0b:8e:d5
    235 120.047868000  fe80::fedd:55ff:fe0b:8ed5 ff02::1               ICMPv6   86     Router Advertisement from fc:dd:55:0b:8e:d5
    236 123.348462000  192.168.1.100         74.125.68.188         TCP      66     [TCP Dup ACK 123#2] 39816 > hpvroom [ACK] Seq=1 Ack=1 Win=260 Len=0 TSval=89809 TSecr=426425022
    237 124.148114000  216.58.196.110        192.168.1.100         TLSv1.2  129    [TCP ACKed unseen segment] Application Data
    238 124.148498000  192.168.1.100         216.58.196.110        TCP      66     [TCP Previous segment not captured] 45965 > https [FIN, ACK] Seq=2 Ack=64 Win=533 Len=0 TSval=90009 TSecr=300776178
    239 124.327933000  216.58.196.110        192.168.1.100         TCP      66     [TCP ACKed unseen segment] https > 45965 [FIN, ACK] Seq=64 Ack=2 Win=480 Len=0 TSval=300776178 TSecr=29830
    240 124.327954000  192.168.1.100         216.58.196.110        TCP      66     45965 > https [ACK] Seq=3 Ack=65 Win=533 Len=0 TSval=90053 TSecr=300776178
    241 124.328154000  216.58.196.110        192.168.1.100         TCP      66     [TCP Out-Of-Order] https > 45965 [FIN, ACK] Seq=64 Ack=2 Win=480 Len=0 TSval=300776546 TSecr=29830
    242 124.328175000  192.168.1.100         216.58.196.110        TCP      78     [TCP Dup ACK 240#1] 45965 > https [ACK] Seq=3 Ack=65 Win=533 Len=0 TSval=90053 TSecr=300776546 SLE=64 SRE=65
    243 124.328287000  74.125.68.188         192.168.1.100         TCP      66     [TCP Dup ACK 124#2] [TCP ACKed unseen segment] hpvroom > 39816 [ACK] Seq=1 Ack=2 Win=358 Len=0 TSval=426470716 TSecr=4294955361
    244 124.328889000  216.58.196.110        192.168.1.100         TCP      66     https > 45965 [ACK] Seq=65 Ack=3 Win=480 Len=0 TSval=300776996 TSecr=90009
    245 125.048971000  fe80::fedd:55ff:fe0b:8ed5 ff02::1               ICMPv6   86     Router Advertisement from fc:dd:55:0b:8e:d5
    246 128.890492000  198.252.206.25        192.168.1.100         TLSv1.2  124    [TCP ACKed unseen segment] Application Data
    247 128.892498000  192.168.1.100         198.252.206.25        TLSv1.2  103    [TCP Previous segment not captured] Application Data
    248 129.351013000  198.252.206.25        192.168.1.100         TCP      66     [TCP ACKed unseen segment] https > 38025 [ACK] Seq=59 Ack=39 Win=33 Len=0 TSval=2397181435 TSecr=91195
    249 130.050001000  fe80::fedd:55ff:fe0b:8ed5 ff02::1               ICMPv6   86     Router Advertisement from fc:dd:55:0b:8e:d5
    250 134.380237000  192.168.1.100         192.168.1.1           DNS      76     Standard query 0xcfe4  A daisy.ubuntu.com
    251 134.380295000  192.168.1.100         192.168.1.1           DNS      76     Standard query 0xb3a9  AAAA daisy.ubuntu.com
    252 134.381912000  192.168.1.100         192.168.1.1           DNS      76     Standard query 0x1231  A www.google.co.in
    253 134.382417000  192.168.1.100         192.168.1.1           DNS      75     Standard query 0x6372  A apis.google.com
    254 134.382628000  192.168.1.100         192.168.1.1           DNS      79     Standard query 0x8fb7  A clients5.google.com
    255 134.382817000  192.168.1.100         192.168.1.1           DNS      85     Standard query 0xb8cc  A lh3.googleusercontent.com
    256 134.469004000  192.168.1.1           192.168.1.100         DNS      314    Standard query response 0xcfe4  A 91.189.92.57 A 91.189.92.55
    257 134.471159000  192.168.1.1           192.168.1.100         DNS      137    Standard query response 0xb3a9 
