No.     Time           Source                Destination           Protocol Length Info
      1 0.000000000    192.168.43.14         74.125.68.95          TCP      66     58642 > https [FIN, PSH, ACK] Seq=1 Ack=1 Win=361 Len=0 TSval=6143096 TSecr=1624192204
      2 0.007985000    192.168.43.14         192.30.252.124        TCP      66     49389 > https [FIN, PSH, ACK] Seq=1 Ack=1 Win=229 Len=0 TSval=6143098 TSecr=1647381593
      3 0.119135000    74.125.68.95          192.168.43.14         TCP      66     https > 58642 [FIN, ACK] Seq=1 Ack=2 Win=350 Len=0 TSval=1624228394 TSecr=6143096
      4 0.119191000    192.168.43.14         74.125.68.95          TCP      66     58642 > https [ACK] Seq=2 Ack=2 Win=361 Len=0 TSval=6143125 TSecr=1624228394
      5 0.474948000    192.30.252.124        192.168.43.14         TCP      66     https > 49389 [FIN, ACK] Seq=1 Ack=2 Win=14 Len=0 TSval=1647392853 TSecr=6143098
      6 0.475020000    192.168.43.14         192.30.252.124        TCP      66     49389 > https [ACK] Seq=2 Ack=2 Win=229 Len=0 TSval=6143214 TSecr=1647392853
      7 0.512031000    192.168.43.14         103.245.222.133       TCP      66     41237 > https [FIN, PSH, ACK] Seq=1 Ack=1 Win=229 Len=0 TSval=6143224 TSecr=202877413
      8 0.512089000    192.168.43.14         103.245.222.133       TCP      66     41227 > https [FIN, PSH, ACK] Seq=1 Ack=1 Win=229 Len=0 TSval=6143224 TSecr=224873746
      9 0.512098000    192.168.43.14         103.245.222.133       TCP      66     41238 > https [FIN, PSH, ACK] Seq=1 Ack=1 Win=229 Len=0 TSval=6143224 TSecr=224874354
     10 0.512101000    192.168.43.14         103.245.222.133       TCP      66     41229 > https [FIN, PSH, ACK] Seq=1 Ack=1 Win=229 Len=0 TSval=6143224 TSecr=1173121564
     11 0.512104000    192.168.43.14         103.245.222.133       TCP      66     41230 > https [FIN, PSH, ACK] Seq=1 Ack=1 Win=229 Len=0 TSval=6143224 TSecr=1173121567
     12 0.543509000    192.168.43.14         91.189.94.4           NTP      90     NTP Version 4, client
     13 0.575993000    192.168.43.14         184.31.42.239         TCP      66     44679 > https [FIN, PSH, ACK] Seq=1 Ack=1 Win=237 Len=0 TSval=6143240 TSecr=4234846062
     14 0.592026000    192.168.43.14         103.245.222.133       TCP      66     41216 > https [FIN, PSH, ACK] Seq=1 Ack=1 Win=338 Len=0 TSval=6143244 TSecr=1218412358
     15 0.592101000    192.168.43.14         103.245.222.133       TCP      66     41217 > https [FIN, PSH, ACK] Seq=1 Ack=1 Win=338 Len=0 TSval=6143244 TSecr=1132034509
     16 0.630277000    192.168.43.14         224.0.0.251           MDNS     87     Standard query 0x0000  PTR _ipps._tcp.local, "QM" question PTR _ipp._tcp.local, "QM" question
     17 0.662079000    103.245.222.133       192.168.43.14         TCP      66     https > 41237 [FIN, ACK] Seq=1 Ack=2 Win=57 Len=0 TSval=202890170 TSecr=6143224
     18 0.662137000    192.168.43.14         103.245.222.133       TCP      66     41237 > https [ACK] Seq=2 Ack=2 Win=229 Len=0 TSval=6143261 TSecr=202890170
     19 0.662080000    103.245.222.133       192.168.43.14         TCP      66     https > 41227 [FIN, ACK] Seq=1 Ack=2 Win=57 Len=0 TSval=224887114 TSecr=6143224
     20 0.662187000    192.168.43.14         103.245.222.133       TCP      66     41227 > https [ACK] Seq=2 Ack=2 Win=229 Len=0 TSval=6143261 TSecr=224887114
     21 0.663755000    103.245.222.133       192.168.43.14         TCP      66     https > 41238 [FIN, ACK] Seq=1 Ack=2 Win=57 Len=0 TSval=224887117 TSecr=6143224
     22 0.663776000    192.168.43.14         103.245.222.133       TCP      66     41238 > https [ACK] Seq=2 Ack=2 Win=229 Len=0 TSval=6143261 TSecr=224887117
     23 0.683590000    103.245.222.133       192.168.43.14         TCP      66     https > 41229 [FIN, ACK] Seq=1 Ack=2 Win=57 Len=0 TSval=1173134927 TSecr=6143224
     24 0.683646000    192.168.43.14         103.245.222.133       TCP      66     41229 > https [ACK] Seq=2 Ack=2 Win=229 Len=0 TSval=6143266 TSecr=1173134927
     25 0.683723000    103.245.222.133       192.168.43.14         TCP      66     https > 41230 [FIN, ACK] Seq=1 Ack=2 Win=57 Len=0 TSval=1173134927 TSecr=6143224
     26 0.683729000    192.168.43.14         103.245.222.133       TCP      66     41230 > https [ACK] Seq=2 Ack=2 Win=229 Len=0 TSval=6143266 TSecr=1173134927
     27 0.719202000    103.245.222.133       192.168.43.14         TLSv1.2  97     Encrypted Alert
     28 0.719264000    192.168.43.14         103.245.222.133       TCP      54     41216 > https [RST] Seq=2 Win=0 Len=0
     29 0.719458000    103.245.222.133       192.168.43.14         TCP      66     https > 41216 [FIN, ACK] Seq=32 Ack=2 Win=61 Len=0 TSval=1218424680 TSecr=6143244
     30 0.719468000    192.168.43.14         103.245.222.133       TCP      54     41216 > https [RST] Seq=2 Win=0 Len=0
     31 0.728799000    103.245.222.133       192.168.43.14         TLSv1.2  97     Encrypted Alert
     32 0.728856000    192.168.43.14         103.245.222.133       TCP      54     41217 > https [RST] Seq=2 Win=0 Len=0
     33 0.729054000    103.245.222.133       192.168.43.14         TCP      66     https > 41217 [FIN, ACK] Seq=32 Ack=2 Win=61 Len=0 TSval=1132046826 TSecr=6143244
     34 0.729064000    192.168.43.14         103.245.222.133       TCP      54     41217 > https [RST] Seq=2 Win=0 Len=0
     35 0.743554000    192.168.43.14         91.189.89.199         NTP      90     NTP Version 4, client
     36 0.798505000    184.31.42.239         192.168.43.14         TLSv1.2  119    Encrypted Alert
     37 0.798571000    192.168.43.14         184.31.42.239         TCP      54     44679 > https [RST] Seq=2 Win=0 Len=0
     38 0.798843000    184.31.42.239         192.168.43.14         TCP      66     https > 44679 [FIN, ACK] Seq=54 Ack=2 Win=916 Len=0 TSval=4234897042 TSecr=6143240
     39 0.798896000    192.168.43.14         184.31.42.239         TCP      54     44679 > https [RST] Seq=2 Win=0 Len=0
     40 0.811749000    91.189.94.4           192.168.43.14         NTP      90     NTP Version 4, server
     41 0.992002000    192.168.43.14         216.58.220.13         TCP      66     51506 > https [FIN, PSH, ACK] Seq=1 Ack=1 Win=317 Len=0 TSval=6143344 TSecr=1501622644
     42 1.003284000    91.189.89.199         192.168.43.14         NTP      90     NTP Version 4, server
     43 1.093973000    216.58.220.13         192.168.43.14         TCP      66     https > 51506 [FIN, ACK] Seq=1 Ack=2 Win=350 Len=0 TSval=1501660615 TSecr=6143344
     44 1.094054000    192.168.43.14         216.58.220.13         TCP      66     51506 > https [ACK] Seq=2 Ack=2 Win=317 Len=0 TSval=6143369 TSecr=1501660615
     45 1.312007000    192.168.43.14         192.30.252.130        TCP      66     33840 > https [FIN, PSH, ACK] Seq=1 Ack=1 Win=229 Len=0 TSval=6143424 TSecr=1169498945
     46 1.703755000    192.30.252.130        192.168.43.14         TCP      66     https > 33840 [FIN, ACK] Seq=1 Ack=2 Win=14 Len=0 TSval=1169512795 TSecr=6143424
     47 1.703836000    192.168.43.14         192.30.252.130        TCP      66     33840 > https [ACK] Seq=2 Ack=2 Win=229 Len=0 TSval=6143521 TSecr=1169512795
     48 1.760017000    192.168.43.14         173.194.120.152       TCP      66     34635 > http [FIN, PSH, ACK] Seq=1 Ack=1 Win=245 Len=0 TSval=6143536 TSecr=2694616664
     49 1.846066000    173.194.120.152       192.168.43.14         TCP      66     http > 34635 [ACK] Seq=1 Ack=2 Win=37744 Len=0 TSval=2694619288 TSecr=6143536
     50 1.956522000    MS-NLB-PhysServer-26_11:f0:d1:c4 Azurewav_f1:5b:cc     ARP      42     Who has 192.168.43.14?  Tell 192.168.43.1
     51 1.956570000    Azurewav_f1:5b:cc     MS-NLB-PhysServer-26_11:f0:d1:c4 ARP      42     192.168.43.14 is at 6c:71:d9:f1:5b:cc
     52 1.967164000    192.168.43.14         192.168.43.1          DNS      76     Standard query 0xaadd  A www.google.co.in
     53 1.970354000    192.168.43.1          192.168.43.14         DNS      140    Standard query response 0xaadd  A 173.194.120.143 A 173.194.120.151 A 173.194.120.159 A 173.194.120.152
     54 1.970561000    192.168.43.14         173.194.120.143       TCP      74     37423 > http [SYN] Seq=0 Win=29200 Len=0 MSS=1460 SACK_PERM=1 TSval=6143588 TSecr=0 WS=128
     55 1.970630000    192.168.43.14         173.194.120.143       TCP      74     37424 > http [SYN] Seq=0 Win=29200 Len=0 MSS=1460 SACK_PERM=1 TSval=6143588 TSecr=0 WS=128
     56 1.970680000    192.168.43.14         173.194.120.143       TCP      74     37425 > http [SYN] Seq=0 Win=29200 Len=0 MSS=1460 SACK_PERM=1 TSval=6143588 TSecr=0 WS=128
     57 1.970693000    192.168.43.14         173.194.120.143       TCP      74     37426 > http [SYN] Seq=0 Win=29200 Len=0 MSS=1460 SACK_PERM=1 TSval=6143588 TSecr=0 WS=128
     58 2.053836000    173.194.120.143       192.168.43.14         TCP      78     http > 37423 [SYN, ACK] Seq=0 Ack=1 Win=37744 Len=0 TSval=2694619311 TSecr=6143588 MSS=1360 WS=4 SACK_PERM=1
     59 2.053906000    192.168.43.14         173.194.120.143       TCP      66     37423 > http [ACK] Seq=1 Ack=1 Win=29312 Len=0 TSval=6143609 TSecr=2694619311
     60 2.053978000    173.194.120.143       192.168.43.14         TCP      78     http > 37425 [SYN, ACK] Seq=0 Ack=1 Win=37744 Len=0 TSval=2694619311 TSecr=6143588 MSS=1360 WS=4 SACK_PERM=1
     61 2.053986000    192.168.43.14         173.194.120.143       TCP      66     37425 > http [ACK] Seq=1 Ack=1 Win=29312 Len=0 TSval=6143609 TSecr=2694619311
     62 2.054005000    192.168.43.14         173.194.120.143       HTTP     846    GET / HTTP/1.1 
     63 2.054752000    173.194.120.143       192.168.43.14         TCP      78     http > 37424 [SYN, ACK] Seq=0 Ack=1 Win=37744 Len=0 TSval=2694619311 TSecr=6143588 MSS=1360 WS=4 SACK_PERM=1
     64 2.054765000    192.168.43.14         173.194.120.143       TCP      66     37424 > http [ACK] Seq=1 Ack=1 Win=29312 Len=0 TSval=6143609 TSecr=2694619311
     65 2.061913000    173.194.120.143       192.168.43.14         TCP      78     http > 37426 [SYN, ACK] Seq=0 Ack=1 Win=37744 Len=0 TSval=2694619312 TSecr=6143588 MSS=1360 WS=4 SACK_PERM=1
     66 2.061989000    192.168.43.14         173.194.120.143       TCP      66     37426 > http [ACK] Seq=1 Ack=1 Win=29312 Len=0 TSval=6143611 TSecr=2694619312
     67 2.164189000    173.194.120.143       192.168.43.14         TCP      66     http > 37423 [ACK] Seq=1 Ack=781 Win=4831232 Len=0 TSval=2694619322 TSecr=6143609
     68 2.220248000    fe80::6e71:d9ff:fef1:5bcc ff02::fb              MDNS     107    Standard query 0x0000  PTR _ipps._tcp.local, "QM" question PTR _ipp._tcp.local, "QM" question
     69 2.223483000    173.194.120.143       192.168.43.14         TCP      74     [TCP ACKed unseen segment] [TCP Previous segment not captured] http > 37423 [SYN, ACK] Seq=986257315 Ack=1250108060 Win=42540 Len=0 MSS=1380 SACK_PERM=1 TSval=3317785308 TSecr=2694619322 WS=128
     70 2.223551000    192.168.43.14         173.194.120.143       TCP      66     [TCP Dup ACK 62#1] 37423 > http [ACK] Seq=781 Ack=1 Win=29312 Len=0 TSval=6143651 TSecr=2694619322
     71 2.496016000    192.168.43.14         192.30.252.90         TCP      66     44502 > https [ACK] Seq=1 Ack=1 Win=245 Len=0 TSval=6143720 TSecr=926580459
     72 2.727942000    173.194.120.143       192.168.43.14         TCP      74     [TCP ACKed unseen segment] [TCP Retransmission] http > 37423 [SYN, ACK] Seq=986257315 Ack=1250108060 Win=42540 Len=0 MSS=1380 SACK_PERM=1 TSval=3317785798 TSecr=2694619322 WS=128
     73 2.728020000    192.168.43.14         173.194.120.143       TCP      66     [TCP Dup ACK 62#2] 37423 > http [ACK] Seq=781 Ack=1 Win=29312 Len=0 TSval=6143777 TSecr=2694619322
     74 2.743499000    192.168.43.14         91.189.94.4           NTP      90     NTP Version 4, client
     75 2.801977000    192.30.252.90         192.168.43.14         TCP      66     [TCP ACKed unseen segment] https > 44502 [ACK] Seq=1 Ack=2 Win=31 Len=0 TSval=926591788 TSecr=6132366
     76 2.943561000    192.168.43.14         91.189.89.199         NTP      90     NTP Version 4, client
     77 2.971998000    91.189.94.4           192.168.43.14         NTP      90     NTP Version 4, server
     78 3.127992000    fe80::6e71:d9ff:fef1:5bcc ff02::2               ICMPv6   70     Router Solicitation from 6c:71:d9:f1:5b:cc
     79 3.342303000    91.189.89.199         192.168.43.14         NTP      90     NTP Version 4, server
     80 3.343654000    173.194.120.143       192.168.43.14         TCP      74     [TCP ACKed unseen segment] [TCP Retransmission] http > 37423 [SYN, ACK] Seq=986257315 Ack=1250108060 Win=42540 Len=0 MSS=1380 SACK_PERM=1 TSval=3317786432 TSecr=2694619322 WS=128
     81 3.343721000    192.168.43.14         173.194.120.143       TCP      66     [TCP Dup ACK 62#3] 37423 > http [ACK] Seq=781 Ack=1 Win=29312 Len=0 TSval=6143931 TSecr=2694619322
     82 3.501134000    192.168.43.14         192.168.43.1          DNS      81     Standard query 0xd0f1  A m-static.ak.fbcdn.net
     83 3.501458000    192.168.43.14         192.168.43.1          DNS      74     Standard query 0xdcc9  A m.ak.fbcdn.net
     84 3.501613000    192.168.43.14         192.168.43.1          DNS      88     Standard query 0x7bb1  A scontent-sin1-1.xx.fbcdn.net
     85 3.501820000    192.168.43.14         192.168.43.1          DNS      83     Standard query 0x3c2a  A z-1-static.xx.fbcdn.net
     86 3.531002000    192.168.43.14         31.13.78.35           TLSv1.2  371    Application Data
     87 3.751880000    192.168.43.1          192.168.43.14         DNS      164    Standard query response 0xd0f1  CNAME m-static.ak.edgekey.net CNAME e906.cc.akamaiedge.net A 184.31.35.206
     88 3.752378000    192.168.43.14         184.31.35.206         TCP      74     40490 > https [SYN] Seq=0 Win=29200 Len=0 MSS=1460 SACK_PERM=1 TSval=6144034 TSecr=0 WS=128
     89 3.753038000    192.168.43.1          192.168.43.14         DNS      151    Standard query response 0xdcc9  CNAME m.ak.edgekey.net CNAME e2665.cc.akamaiedge.net A 184.31.42.239
     90 3.753042000    192.168.43.1          192.168.43.14         DNS      227    Standard query response 0x7bb1  A 31.13.79.251
     91 3.753044000    192.168.43.1          192.168.43.14         DNS      249    Standard query response 0x3c2a  CNAME z-1-scontent.xx.fbcdn.net A 31.13.79.208
     92 3.753052000    31.13.78.35           192.168.43.14         TLSv1.2  108    Application Data
     93 3.753177000    192.168.43.14         31.13.78.35           TCP      66     52051 > https [ACK] Seq=306 Ack=43 Win=254 Len=0 TSval=6144034 TSecr=1009484037
     94 3.753546000    192.168.43.14         184.31.42.239         TCP      74     44714 > https [SYN] Seq=0 Win=29200 Len=0 MSS=1460 SACK_PERM=1 TSval=6144034 TSecr=0 WS=128
     95 3.753852000    192.168.43.14         31.13.79.251          TCP      74     44473 > https [SYN] Seq=0 Win=29200 Len=0 MSS=1460 SACK_PERM=1 TSval=6144034 TSecr=0 WS=128
     96 3.754038000    192.168.43.14         31.13.79.208          TCP      74     53903 > https [SYN] Seq=0 Win=29200 Len=0 MSS=1460 SACK_PERM=1 TSval=6144034 TSecr=0 WS=128
     97 3.822069000    31.13.78.35           192.168.43.14         TLSv1.2  368    Application Data
     98 3.822130000    192.168.43.14         31.13.78.35           TCP      66     52051 > https [ACK] Seq=306 Ack=345 Win=270 Len=0 TSval=6144051 TSecr=1009484233
     99 3.822292000    31.13.78.35           192.168.43.14         TLSv1.2  1075   Application Data
    100 3.822316000    192.168.43.14         31.13.78.35           TCP      66     52051 > https [ACK] Seq=306 Ack=1354 Win=287 Len=0 TSval=6144051 TSecr=1009484233
    101 3.843434000    31.13.79.251          192.168.43.14         TCP      74     https > 44473 [SYN, ACK] Seq=0 Ack=1 Win=13980 Len=0 MSS=1380 SACK_PERM=1 TSval=1055170746 TSecr=6144034 WS=256
    102 3.843499000    192.168.43.14         31.13.79.251          TCP      66     44473 > https [ACK] Seq=1 Ack=1 Win=29312 Len=0 TSval=6144056 TSecr=1055170746
    103 3.843670000    192.168.43.14         31.13.79.251          TLSv1.2  583    Client Hello
    104 3.845753000    192.168.43.14         31.13.78.13           TLSv1.2  108    Application Data
    105 3.853021000    31.13.79.208          192.168.43.14         TCP      74     https > 53903 [SYN, ACK] Seq=0 Ack=1 Win=13980 Len=0 MSS=1380 SACK_PERM=1 TSval=1760280278 TSecr=6144034 WS=256
    106 3.853065000    192.168.43.14         31.13.79.208          TCP      66     53903 > https [ACK] Seq=1 Ack=1 Win=29312 Len=0 TSval=6144059 TSecr=1760280278
    107 3.853192000    192.168.43.14         31.13.79.208          TLSv1.2  289    Client Hello
    108 3.903701000    192.168.43.14         192.168.43.1          DNS      81     Standard query 0xb4df  A m-static.ak.fbcdn.net
    109 3.906403000    192.168.43.1          192.168.43.14         DNS      170    Standard query response 0xb4df  CNAME m-static.ak.edgekey.net CNAME e906.cc.akamaiedge.net A 184.31.35.206
    110 3.906608000    192.168.43.14         184.31.35.206         TCP      74     40494 > https [SYN] Seq=0 Win=29200 Len=0 MSS=1460 SACK_PERM=1 TSval=6144072 TSecr=0 WS=128
    111 3.906713000    192.168.43.14         184.31.35.206         TCP      74     40495 > https [SYN] Seq=0 Win=29200 Len=0 MSS=1460 SACK_PERM=1 TSval=6144072 TSecr=0 WS=128
    112 3.906744000    192.168.43.14         184.31.35.206         TCP      74     40496 > https [SYN] Seq=0 Win=29200 Len=0 MSS=1460 SACK_PERM=1 TSval=6144072 TSecr=0 WS=128
    113 3.906791000    192.168.43.14         184.31.35.206         TCP      74     40497 > https [SYN] Seq=0 Win=29200 Len=0 MSS=1460 SACK_PERM=1 TSval=6144072 TSecr=0 WS=128
    114 3.906822000    192.168.43.14         184.31.35.206         TCP      74     40498 > https [SYN] Seq=0 Win=29200 Len=0 MSS=1460 SACK_PERM=1 TSval=6144072 TSecr=0 WS=128
    115 3.906856000    192.168.43.14         184.31.35.206         TCP      74     40499 > https [SYN] Seq=0 Win=29200 Len=0 MSS=1460 SACK_PERM=1 TSval=6144072 TSecr=0 WS=128
    116 3.919227000    184.31.35.206         192.168.43.14         TCP      74     https > 40490 [SYN, ACK] Seq=0 Ack=1 Win=28960 Len=0 MSS=1380 SACK_PERM=1 TSval=286629947 TSecr=6144034 WS=32
    117 3.919286000    192.168.43.14         184.31.35.206         TCP      66     40490 > https [ACK] Seq=1 Ack=1 Win=29312 Len=0 TSval=6144075 TSecr=286629947
    118 3.919410000    192.168.43.14         184.31.35.206         TLSv1.2  583    Client Hello
    119 3.931723000    184.31.42.239         192.168.43.14         TCP      74     https > 44714 [SYN, ACK] Seq=0 Ack=1 Win=28240 Len=0 MSS=1380 SACK_PERM=1 TSval=3667358246 TSecr=6144034 WS=32
    120 3.931879000    192.168.43.14         184.31.42.239         TCP      66     44714 > https [ACK] Seq=1 Ack=1 Win=29312 Len=0 TSval=6144078 TSecr=3667358246
    121 3.932284000    192.168.43.14         184.31.42.239         TLSv1.2  583    Client Hello
    122 3.951862000    31.13.79.251          192.168.43.14         TCP      66     https > 44473 [ACK] Seq=1 Ack=518 Win=15104 Len=0 TSval=1055170854 TSecr=6144056
    123 3.952171000    31.13.79.251          192.168.43.14         TLSv1.2  248    Server Hello, Change Cipher Spec, Encrypted Handshake Message
    124 3.952207000    192.168.43.14         31.13.79.251          TCP      66     44473 > https [ACK] Seq=518 Ack=183 Win=30336 Len=0 TSval=6144084 TSecr=1055170854
    125 3.952405000    192.168.43.14         31.13.79.251          TLSv1.2  182    Change Cipher Spec, Hello Request, Hello Request, Hello Request, Hello Request
    126 3.981987000    31.13.79.208          192.168.43.14         TCP      66     https > 53903 [ACK] Seq=1 Ack=224 Win=15104 Len=0 TSval=1760280403 TSecr=6144059
    127 3.982476000    31.13.79.208          192.168.43.14         TLSv1.2  1434   Server Hello
    128 3.982488000    192.168.43.14         31.13.79.208          TCP      66     53903 > https [ACK] Seq=224 Ack=1369 Win=32128 Len=0 TSval=6144091 TSecr=1760280403
    129 3.993663000    31.13.79.208          192.168.43.14         TLSv1.2  1434   Certificate
    130 3.993714000    192.168.43.14         31.13.79.208          TCP      66     53903 > https [ACK] Seq=224 Ack=2737 Win=35072 Len=0 TSval=6144094 TSecr=1760280403
    131 3.993983000    31.13.79.208          192.168.43.14         TLSv1.2  143    Server Key Exchange
    132 3.993994000    192.168.43.14         31.13.79.208          TCP      66     53903 > https [ACK] Seq=224 Ack=2814 Win=35072 Len=0 TSval=6144094 TSecr=1760280403
    133 3.994522000    192.168.43.14         31.13.79.208          TLSv1.2  257    Client Key Exchange, Change Cipher Spec, Hello Request, Hello Request, Hello Request, Hello Request
    134 4.008115000    31.13.78.13           192.168.43.14         TCP      66     https > 45327 [ACK] Seq=1 Ack=43 Win=75 Len=0 TSval=3739112548 TSecr=6144057
    135 4.021962000    31.13.78.35           192.168.43.14         TCP      1434   [TCP segment of a reassembled PDU]
    136 4.022025000    192.168.43.14         31.13.78.35           TCP      66     52051 > https [ACK] Seq=306 Ack=2722 Win=310 Len=0 TSval=6144101 TSecr=1009484425
    137 4.022139000    31.13.78.35           192.168.43.14         TLSv1.2  259    Application Data
    138 4.022176000    192.168.43.14         31.13.78.35           TCP      66     52051 > https [ACK] Seq=306 Ack=2915 Win=331 Len=0 TSval=6144101 TSecr=1009484425
    139 4.023075000    31.13.78.35           192.168.43.14         TCP      1434   [TCP segment of a reassembled PDU]
    140 4.023081000    192.168.43.14         31.13.78.35           TCP      66     52051 > https [ACK] Seq=306 Ack=4283 Win=354 Len=0 TSval=6144101 TSecr=1009484425
    141 4.023180000    31.13.78.35           192.168.43.14         TLSv1.2  1337   Application Data
    142 4.023186000    192.168.43.14         31.13.78.35           TCP      66     52051 > https [ACK] Seq=306 Ack=5554 Win=375 Len=0 TSval=6144101 TSecr=1009484425
    143 4.023333000    31.13.78.35           192.168.43.14         TCP      1434   [TCP segment of a reassembled PDU]
    144 4.023339000    192.168.43.14         31.13.78.35           TCP      66     52051 > https [ACK] Seq=306 Ack=6922 Win=398 Len=0 TSval=6144101 TSecr=1009484425
    145 4.026828000    192.168.43.14         31.13.79.251          TLSv1.2  374    Application Data
    146 4.027554000    192.168.43.14         192.168.43.1          DNS      81     Standard query 0xcdf8  A m-static.ak.fbcdn.net
    147 4.030142000    192.168.43.1          192.168.43.14         DNS      170    Standard query response 0xcdf8  CNAME m-static.ak.edgekey.net CNAME e906.cc.akamaiedge.net A 184.31.35.206
    148 4.030321000    192.168.43.14         184.31.35.206         TCP      74     40500 > https [SYN] Seq=0 Win=29200 Len=0 MSS=1460 SACK_PERM=1 TSval=6144103 TSecr=0 WS=128
    149 4.043468000    31.13.78.35           192.168.43.14         TLSv1.2  1434   Application Data
    150 4.043517000    192.168.43.14         31.13.78.35           TCP      66     52051 > https [ACK] Seq=306 Ack=8290 Win=420 Len=0 TSval=6144106 TSecr=1009484425
    151 4.044028000    31.13.78.35           192.168.43.14         TCP      1434   [TCP segment of a reassembled PDU]
    152 4.044057000    192.168.43.14         31.13.78.35           TCP      66     52051 > https [ACK] Seq=306 Ack=9658 Win=443 Len=0 TSval=6144107 TSecr=1009484425
    153 4.044170000    31.13.78.35           192.168.43.14         TLSv1.2  1434   Application Data
    154 4.044176000    192.168.43.14         31.13.78.35           TCP      66     52051 > https [ACK] Seq=306 Ack=11026 Win=466 Len=0 TSval=6144107 TSecr=1009484425
    155 4.044359000    31.13.78.35           192.168.43.14         TCP      1434   [TCP segment of a reassembled PDU]
    156 4.044381000    192.168.43.14         31.13.78.35           TCP      66     52051 > https [ACK] Seq=306 Ack=12394 Win=488 Len=0 TSval=6144107 TSecr=1009484425
    157 4.044361000    31.13.78.35           192.168.43.14         TCP      1434   [TCP segment of a reassembled PDU]
    158 4.044388000    192.168.43.14         31.13.78.35           TCP      66     52051 > https [ACK] Seq=306 Ack=13762 Win=511 Len=0 TSval=6144107 TSecr=1009484425
    159 4.051788000    192.168.43.14         192.168.43.1          DNS      81     Standard query 0x129d  A m-static.ak.fbcdn.net
    160 4.054404000    192.168.43.1          192.168.43.14         DNS      170    Standard query response 0x129d  CNAME m-static.ak.edgekey.net CNAME e906.cc.akamaiedge.net A 184.31.35.206
    161 4.054811000    192.168.43.14         184.31.35.206         TCP      74     40501 > https [SYN] Seq=0 Win=29200 Len=0 MSS=1460 SACK_PERM=1 TSval=6144109 TSecr=0 WS=128
    162 4.069061000    31.13.79.251          192.168.43.14         TLSv1.2  123    Application Data
    163 4.069397000    184.31.35.206         192.168.43.14         TCP      74     https > 40494 [SYN, ACK] Seq=0 Ack=1 Win=28240 Len=0 MSS=1380 SACK_PERM=1 TSval=4154472149 TSecr=6144072 WS=32
    164 4.069479000    192.168.43.14         184.31.35.206         TCP      66     40494 > https [ACK] Seq=1 Ack=1 Win=29312 Len=0 TSval=6144113 TSecr=4154472149
    165 4.069775000    192.168.43.14         184.31.35.206         TLSv1.2  583    Client Hello
    166 4.082140000    184.31.35.206         192.168.43.14         TCP      74     https > 40495 [SYN, ACK] Seq=0 Ack=1 Win=28240 Len=0 MSS=1380 SACK_PERM=1 TSval=4146033374 TSecr=6144072 WS=32
    167 4.082228000    192.168.43.14         184.31.35.206         TCP      66     40495 > https [ACK] Seq=1 Ack=1 Win=29312 Len=0 TSval=6144116 TSecr=4146033374
    168 4.082368000    184.31.35.206         192.168.43.14         TCP      74     https > 40497 [SYN, ACK] Seq=0 Ack=1 Win=28240 Len=0 MSS=1380 SACK_PERM=1 TSval=18906462 TSecr=6144072 WS=32
    169 4.082462000    192.168.43.14         184.31.35.206         TCP      66     40497 > https [ACK] Seq=1 Ack=1 Win=29312 Len=0 TSval=6144116 TSecr=18906462
    170 4.082535000    184.31.35.206         192.168.43.14         TCP      74     https > 40496 [SYN, ACK] Seq=0 Ack=1 Win=28240 Len=0 MSS=1380 SACK_PERM=1 TSval=4154472157 TSecr=6144072 WS=32
    171 4.082558000    192.168.43.14         184.31.35.206         TCP      66     40496 > https [ACK] Seq=1 Ack=1 Win=29312 Len=0 TSval=6144116 TSecr=4154472157
    172 4.082569000    192.168.43.14         184.31.35.206         TLSv1.2  583    Client Hello
    173 4.082972000    192.168.43.14         184.31.35.206         TLSv1.2  583    Client Hello
    174 4.083218000    192.168.43.14         184.31.35.206         TLSv1.2  583    Client Hello
    175 4.108017000    192.168.43.14         31.13.79.251          TCP      66     44473 > https [ACK] Seq=634 Ack=240 Win=30336 Len=0 TSval=6144123 TSecr=1055170964
    176 4.110605000    184.31.35.206         192.168.43.14         TCP      74     https > 40498 [SYN, ACK] Seq=0 Ack=1 Win=28240 Len=0 MSS=1380 SACK_PERM=1 TSval=4154507396 TSecr=6144072 WS=32
    177 4.110690000    192.168.43.14         184.31.35.206         TCP      66     40498 > https [ACK] Seq=1 Ack=1 Win=29312 Len=0 TSval=6144123 TSecr=4154507396
    178 4.110771000    184.31.35.206         192.168.43.14         TCP      74     https > 40499 [SYN, ACK] Seq=0 Ack=1 Win=28240 Len=0 MSS=1380 SACK_PERM=1 TSval=3667358399 TSecr=6144072 WS=32
    179 4.110787000    192.168.43.14         184.31.35.206         TCP      66     40499 > https [ACK] Seq=1 Ack=1 Win=29312 Len=0 TSval=6144123 TSecr=3667358399
    180 4.110963000    192.168.43.14         184.31.35.206         TLSv1.2  583    Client Hello
    181 4.111170000    192.168.43.14         184.31.35.206         TLSv1.2  583    Client Hello
    182 4.111266000    31.13.79.208          192.168.43.14         TLSv1.2  324    New Session Ticket, Change Cipher Spec, Encrypted Handshake Message
    183 4.111268000    31.13.79.208          192.168.43.14         TLSv1.2  123    Application Data
    184 4.111463000    31.13.78.35           192.168.43.14         TLSv1.2  1434   Application Data
    185 4.111478000    192.168.43.14         31.13.78.35           TCP      66     52051 > https [ACK] Seq=306 Ack=15130 Win=533 Len=0 TSval=6144123 TSecr=1009484512
    186 4.111687000    31.13.78.35           192.168.43.14         TLSv1.2  1434   Application Data
    187 4.111760000    192.168.43.14         31.13.78.35           TCP      66     52051 > https [ACK] Seq=306 Ack=16498 Win=556 Len=0 TSval=6144123 TSecr=1009484512
    188 4.111830000    31.13.78.35           192.168.43.14         TLSv1.2  1434   Application Data
    189 4.111840000    192.168.43.14         31.13.78.35           TCP      66     52051 > https [ACK] Seq=306 Ack=17866 Win=579 Len=0 TSval=6144123 TSecr=1009484515
    190 4.112017000    31.13.78.35           192.168.43.14         TCP      1434   [TCP segment of a reassembled PDU]
    191 4.112089000    192.168.43.14         31.13.78.35           TCP      66     52051 > https [ACK] Seq=306 Ack=19234 Win=601 Len=0 TSval=6144124 TSecr=1009484515
    192 4.112163000    31.13.78.35           192.168.43.14         TLSv1.2  1434   Application Data
    193 4.112174000    192.168.43.14         31.13.78.35           TCP      66     52051 > https [ACK] Seq=306 Ack=20602 Win=624 Len=0 TSval=6144124 TSecr=1009484515
    194 4.114720000    31.13.78.35           192.168.43.14         TLSv1.2  1434   Application Data
    195 4.114781000    192.168.43.14         31.13.78.35           TCP      66     52051 > https [ACK] Seq=306 Ack=21970 Win=647 Len=0 TSval=6144124 TSecr=1009484515
    196 4.114993000    31.13.78.35           192.168.43.14         TLSv1.2  1434   Application Data
    197 4.115070000    192.168.43.14         31.13.78.35           TCP      66     52051 > https [ACK] Seq=306 Ack=23338 Win=669 Len=0 TSval=6144124 TSecr=1009484516
    198 4.115367000    31.13.78.35           192.168.43.14         TLSv1.2  1434   Application Data
    199 4.115425000    192.168.43.14         31.13.78.35           TCP      66     52051 > https [ACK] Seq=306 Ack=24706 Win=692 Len=0 TSval=6144124 TSecr=1009484516
    200 4.122341000    31.13.78.35           192.168.43.14         TLSv1.2  1434   Application Data
    201 4.122407000    192.168.43.14         31.13.78.35           TCP      66     52051 > https [ACK] Seq=306 Ack=26074 Win=714 Len=0 TSval=6144126 TSecr=1009484518
    202 4.122759000    31.13.78.35           192.168.43.14         TLSv1.2  1434   Application Data
    203 4.122822000    192.168.43.14         31.13.78.35           TCP      66     52051 > https [ACK] Seq=306 Ack=27442 Win=737 Len=0 TSval=6144126 TSecr=1009484518
    204 4.122930000    184.31.35.206         192.168.43.14         TCP      66     https > 40490 [ACK] Seq=1 Ack=518 Win=30048 Len=0 TSval=286630141 TSecr=6144075
    205 4.122935000    184.31.35.206         192.168.43.14         TLSv1.2  242    Server Hello, Change Cipher Spec, Encrypted Handshake Message
    206 4.122991000    192.168.43.14         184.31.35.206         TCP      66     40490 > https [ACK] Seq=518 Ack=177 Win=30336 Len=0 TSval=6144126 TSecr=286630141
    207 4.123184000    192.168.43.14         184.31.35.206         TLSv1.2  141    Change Cipher Spec, Encrypted Handshake Message
    208 4.123912000    192.168.43.14         184.31.35.206         TLSv1.2  151    Application Data
    209 4.123953000    192.168.43.14         184.31.35.206         TLSv1.2  135    Application Data
    210 4.124770000    192.168.43.14         184.31.35.206         TLSv1.2  487    Application Data
    211 4.124967000    192.168.43.14         184.31.35.206         TLSv1.2  263    Application Data
    212 4.125126000    192.168.43.14         184.31.35.206         TLSv1.2  263    Application Data
    213 4.127501000    31.13.79.251          192.168.43.14         TLSv1.2  468    Application Data
    214 4.143516000    31.13.78.35           192.168.43.14         TCP      1434   [TCP segment of a reassembled PDU]
    215 4.143584000    192.168.43.14         31.13.78.35           TCP      66     52051 > https [ACK] Seq=306 Ack=28810 Win=760 Len=0 TSval=6144131 TSecr=1009484553
    216 4.143883000    31.13.78.35           192.168.43.14         TLSv1.2  1434   Application Data
    217 4.143904000    192.168.43.14         31.13.78.35           TCP      66     52051 > https [ACK] Seq=306 Ack=30178 Win=782 Len=0 TSval=6144131 TSecr=1009484553
    218 4.146347000    31.13.78.35           192.168.43.14         TLSv1.2  1434   Application Data
    219 4.146406000    192.168.43.14         31.13.78.35           TCP      66     52051 > https [ACK] Seq=306 Ack=31546 Win=805 Len=0 TSval=6144132 TSecr=1009484553
    220 4.147975000    192.168.43.14         31.13.79.208          TCP      66     53903 > https [ACK] Seq=415 Ack=3129 Win=37760 Len=0 TSval=6144133 TSecr=1760280517
    221 4.162006000    31.13.78.35           192.168.43.14         TLSv1.2  1434   Application Data
    222 4.162069000    192.168.43.14         31.13.78.35           TCP      66     52051 > https [ACK] Seq=306 Ack=32914 Win=828 Len=0 TSval=6144136 TSecr=1009484553
    223 4.162317000    31.13.78.35           192.168.43.14         TLSv1.2  1434   Application Data
    224 4.162367000    192.168.43.14         31.13.78.35           TCP      66     52051 > https [ACK] Seq=306 Ack=34282 Win=850 Len=0 TSval=6144136 TSecr=1009484553
    225 4.163982000    192.168.43.14         31.13.79.251          TCP      66     44466 > https [ACK] Seq=309 Ack=403 Win=361 Len=0 TSval=6144137 TSecr=881229831
    226 4.165770000    31.13.78.35           192.168.43.14         TLSv1.2  1434   Application Data
    227 4.165827000    192.168.43.14         31.13.78.35           TCP      66     52051 > https [ACK] Seq=306 Ack=35650 Win=873 Len=0 TSval=6144137 TSecr=1009484553
    228 4.166029000    31.13.78.35           192.168.43.14         TLSv1.2  1434   Application Data
    229 4.166042000    192.168.43.14         31.13.78.35           TCP      66     52051 > https [ACK] Seq=306 Ack=37018 Win=895 Len=0 TSval=6144137 TSecr=1009484553
    230 4.166443000    31.13.78.35           192.168.43.14         TLSv1.2  1434   Application Data
    231 4.166457000    192.168.43.14         31.13.78.35           TCP      66     52051 > https [ACK] Seq=306 Ack=38386 Win=918 Len=0 TSval=6144137 TSecr=1009484553
    232 4.166596000    31.13.78.35           192.168.43.14         TCP      1434   [TCP segment of a reassembled PDU]
    233 4.166611000    192.168.43.14         31.13.78.35           TCP      66     52051 > https [ACK] Seq=306 Ack=39754 Win=941 Len=0 TSval=6144137 TSecr=1009484553
    234 4.172192000    31.13.78.35           192.168.43.14         TLSv1.2  1434   Application Data
    235 4.172266000    192.168.43.14         31.13.78.35           TCP      66     52051 > https [ACK] Seq=306 Ack=41122 Win=963 Len=0 TSval=6144139 TSecr=1009484553
    236 4.172350000    184.31.42.239         192.168.43.14         TCP      66     https > 44714 [ACK] Seq=1 Ack=518 Win=29312 Len=0 TSval=3667358465 TSecr=6144079
    237 4.172905000    184.31.42.239         192.168.43.14         TLSv1.2  242    Server Hello, Change Cipher Spec, Encrypted Handshake Message
    238 4.172922000    192.168.43.14         184.31.42.239         TCP      66     44714 > https [ACK] Seq=518 Ack=177 Win=30336 Len=0 TSval=6144139 TSecr=3667358465
    239 4.173115000    192.168.43.14         184.31.42.239         TLSv1.2  141    Change Cipher Spec, Encrypted Handshake Message
    240 4.212911000    184.31.35.206         192.168.43.14         TCP      74     https > 40500 [SYN, ACK] Seq=0 Ack=1 Win=28240 Len=0 MSS=1380 SACK_PERM=1 TSval=4269840911 TSecr=6144103 WS=32
    241 4.212998000    192.168.43.14         184.31.35.206         TCP      66     40500 > https [ACK] Seq=1 Ack=1 Win=29312 Len=0 TSval=6144149 TSecr=4269840911
    242 4.213323000    192.168.43.14         184.31.35.206         TLSv1.2  583    Client Hello
    243 4.230631000    184.31.35.206         192.168.43.14         TCP      74     https > 40501 [SYN, ACK] Seq=0 Ack=1 Win=28240 Len=0 MSS=1380 SACK_PERM=1 TSval=3659719899 TSecr=6144109 WS=32
    244 4.230727000    192.168.43.14         184.31.35.206         TCP      66     40501 > https [ACK] Seq=1 Ack=1 Win=29312 Len=0 TSval=6144153 TSecr=3659719899
    245 4.230804000    31.13.78.35           192.168.43.14         TLSv1.2  75     Application Data
    246 4.230869000    192.168.43.14         31.13.78.35           TCP      66     52051 > https [ACK] Seq=306 Ack=41131 Win=963 Len=0 TSval=6144153 TSecr=1009484637
    247 4.231099000    192.168.43.14         184.31.35.206         TLSv1.2  583    Client Hello
    248 4.251482000    184.31.35.206         192.168.43.14         TCP      66     https > 40494 [ACK] Seq=1 Ack=518 Win=29312 Len=0 TSval=4154472332 TSecr=6144113
    249 4.251603000    184.31.35.206         192.168.43.14         TLSv1.2  242    Server Hello, Change Cipher Spec, Encrypted Handshake Message
    250 4.251625000    192.168.43.14         184.31.35.206         TCP      66     40494 > https [ACK] Seq=518 Ack=177 Win=30336 Len=0 TSval=6144158 TSecr=4154472332
    251 4.252122000    192.168.43.14         184.31.35.206         TLSv1.2  141    Change Cipher Spec, Encrypted Handshake Message
    252 4.253225000    192.168.43.14         184.31.35.206         TLSv1.2  151    Application Data
    253 4.253352000    192.168.43.14         184.31.35.206         TLSv1.2  135    Application Data
    254 4.255571000    192.168.43.14         184.31.35.206         TLSv1.2  519    Application Data
    255 4.255932000    192.168.43.14         184.31.35.206         TLSv1.2  295    Application Data
    256 4.256373000    192.168.43.14         184.31.35.206         TLSv1.2  295    Application Data
    257 4.256758000    192.168.43.14         184.31.35.206         TLSv1.2  295    Application Data
    258 4.257042000    192.168.43.14         184.31.35.206         TLSv1.2  295    Application Data
    259 4.257313000    192.168.43.14         184.31.35.206         TLSv1.2  295    Application Data
    260 4.257520000    192.168.43.14         184.31.35.206         TLSv1.2  295    Application Data
    261 4.271340000    184.31.35.206         192.168.43.14         TCP      66     https > 40495 [ACK] Seq=1 Ack=518 Win=29312 Len=0 TSval=4146033566 TSecr=6144116
    262 4.271341000    184.31.35.206         192.168.43.14         TLSv1.2  242    Server Hello, Change Cipher Spec, Encrypted Handshake Message
    263 4.271412000    192.168.43.14         184.31.35.206         TCP      66     40495 > https [ACK] Seq=518 Ack=177 Win=30336 Len=0 TSval=6144163 TSecr=4146033566
    264 4.271575000    192.168.43.14         184.31.35.206         TLSv1.2  141    Change Cipher Spec, Encrypted Handshake Message
    265 4.297694000    184.31.35.206         192.168.43.14         TCP      66     https > 40497 [ACK] Seq=1 Ack=518 Win=29312 Len=0 TSval=18906675 TSecr=6144116
    266 4.297810000    184.31.35.206         192.168.43.14         TLSv1.2  242    Server Hello, Change Cipher Spec, Encrypted Handshake Message
    267 4.297821000    192.168.43.14         184.31.35.206         TCP      66     40497 > https [ACK] Seq=518 Ack=177 Win=30336 Len=0 TSval=6144170 TSecr=18906675
    268 4.298015000    192.168.43.14         184.31.35.206         TLSv1.2  141    Change Cipher Spec, Encrypted Handshake Message
    269 4.311296000    31.13.78.35           192.168.43.14         TLSv1.2  859    Application Data
    270 4.311364000    192.168.43.14         31.13.78.35           TCP      66     52051 > https [ACK] Seq=306 Ack=41924 Win=985 Len=0 TSval=6144173 TSecr=1009484729
    271 4.329430000    184.31.35.206         192.168.43.14         TLSv1.2  151    Application Data
    272 4.329827000    184.31.35.206         192.168.43.14         TCP      66     https > 40496 [ACK] Seq=1 Ack=518 Win=29312 Len=0 TSval=4154472404 TSecr=6144116
